{
  "schemaVersion": "2.0.0",
  "id": "change:synthetic-2026-001:deadline-extension",
  "opportunityId": "opp:es-asturias:synthetic-2026-001",
  "fromVersionId": "oppver:sha256:3333333333333333333333333333333333333333333333333333333333333333",
  "toVersionId": "oppver:sha256:2222222222222222222222222222222222222222222222222222222222222222",
  "classification": "urgent",
  "changedPaths": ["/applicationWindows/0/closesAt"],
  "summary": "El plazo sintético se amplía hasta el 15 de octubre de 2026.",
  "observedAt": "2026-09-07T15:30:00Z",
  "effectiveAt": "2026-09-07T12:00:00+02:00",
  "sourceRecordIds": ["src:bdns:synthetic-2026-001"],
  "documentRevisionIds": ["docrev:sha256:1111111111111111111111111111111111111111111111111111111111111111"]
}
